"","Review..","Brand","Variety","Style","Country","Stars","Flavour"
"876",2539,"Nissin","demae iccho tonkotsu flavour instant noodle","Cup","Hong Kong","3.75","tonkotsu"
"877",2437,"Nissin","raoh nojyuku toro tonkotsu ramen","Bowl","Japan","4.5","tonkotsu"
"878",2347,"Nissin","demae iccho tonkotsu flavour instant noodle (bowl noodle)","Bowl","Hong Kong","3","tonkotsu"
"879",2326,"Nissin","demae iccho tokyo shoru tonkotsu instant noodle","Cup","Hong Kong","4","tonkotsu"
"880",2306,"Nissin","demae iccho black garlic oil tonkotsu flavour instant noodles","Cup","Hong Kong","4.00","tonkotsu"
"881",2290,"Nissin","demae ramen straight noodle black garlic oil tonkotsu flavour instant noodle","Pack","Hong Kong","5","tonkotsu"
"882",2279,"Nissin","demae iccho spicy tonkotsu flavour instant noodle (bowl noodle)","Bowl","Hong Kong","5","tonkotsu"
"883",2236,"Maruchan","gotsumori koku tonkotsu ramen","Bowl","Japan","4","tonkotsu"
"884",2230,"Marutai","kuroma-yu tonkotsu kumamoto ramen","Pack","Japan","4","tonkotsu"
"885",2209,"Nissin","demae ramen spicy hot tonkotsu flavour instant noodle","Pack","Hong Kong","5","tonkotsu"
"886",2207,"Nissin","big cup noodles tonkotsu flavour","Cup","Hong Kong","3","tonkotsu"
"887",2206,"Nissin","deka buto kuro m-yu tonkotsu","Bowl","Japan","5","tonkotsu"
"888",2190,"Myojo","barikata noukou tonkotsu shoyu","Bowl","Japan","4.75","tonkotsu"
"889",2096,"Maruchan","seimen noukou toro tonkotsu","Bowl","Japan","4","tonkotsu"
"890",2084,"Nissin","demae ramen straight noodle kyushu tonkotsu instant noodle","Pack","Hong Kong","5","tonkotsu"
"891",2076,"Nissin","demae iccho black garlic oil tonkotsu","Bowl","Hong Kong","3.75","tonkotsu"
"892",2066,"Marutai","hakata tonkotsu ramen","Pack","Japan","5","tonkotsu"
"893",2055,"Nissin","tokyo tokunou gyokai tonkotsu","Bowl","Japan","5","tonkotsu"
"894",2048,"Acecook","kadomen koikoku tonkotsu","Bowl","Japan","3.8","tonkotsu"
"895",2030,"Myojo","charumera atyificial tonkotsu shouyu flavor","Pack","Japan","3.75","tonkotsu"
"896",2019,"Acecook","seabura tonkotsu ramen","Cup","Japan","3.75","tonkotsu"
"897",1997,"Nissin","cup noodle vegeta buta-kyabetsu tonkotsu","Cup","Japan","4.3","tonkotsu"
"898",1993,"Nissin","raoh tonkotsu","Pack","Japan","5","tonkotsu"
"899",1927,"Marutai","kogashi megiiri tonkotsu kagoshima ramen","Bowl","Japan","3.5","tonkotsu"
"900",1908,"Nissin","kuroma-yu tonkotsu kumamoto ramen","Bowl","Japan","4.75","tonkotsu"
"901",1903,"Higashimaru","tonkotsu ramen","Pack","Japan","4.5","tonkotsu"
"902",1868,"Marutai","kuroma-yu tonkotsu kumamoto ramen","Bowl","Japan","4","tonkotsu"
"903",1809,"Marutai","nagahama hakata tonkotsu ramen","Bowl","Japan","4.75","tonkotsu"
"904",1784,"Torishi","hakata tonkotsu ramen","Pack","Japan","5","tonkotsu"
"905",1662,"Mama","non-fried instant noodles ramen tonkotsu flavor","Pack","Thailand","5","tonkotsu"
"906",1621,"Myojo","menwhite creamy tonkotsu","Bowl","Japan","3","tonkotsu"
"907",1551,"Myojo","men black seafood tonkotsu","Bowl","Japan","3.5","tonkotsu"
"908",1304,"Nissin","demae ramen shoyu tonkotsu artificial pork flavour","Pack","Hong Kong","4.75","tonkotsu"
"909",1287,"Kimura","kumamoto tonkotsu ramen","Pack","Japan","5","tonkotsu"
"910",1281,"Tokachimen Koubou","jet black sesame oil pork tonkotsu","Bowl","Japan","2.25","tonkotsu"
"911",1247,"Maruchan","i want to eat ramen pork tonkotsu flavor","Pack","Japan","4","tonkotsu"
"912",1235,"Nissin","demae ramen miso tonkotsu artificial pork flavor ramen noodle","Pack","Hong Kong","3.75","tonkotsu"
"913",1229,"Kumamoto","tonkotsu ramen mega dragon","Pack","Japan","2.5","tonkotsu"
"914",1200,"Men-Sunaoshi","tonkotsu ramen","Pack","Japan","3.75","tonkotsu"
"915",791,"Acecook","super big ramen tonkotsu","Bowl","Japan","1","tonkotsu"
"916",702,"Nissin","demae ramen black garlic oil tonkotsu","Pack","Japan","4.5","tonkotsu"
"917",363,"Nissin","demae iccho tonkotsu macaroni","Pack","Japan","3.5","tonkotsu"
"918",2264,"Unif Tung-I","instant vegetarian beehoon rice vermicelli","Pack","Taiwan","1","vegetarian"
"919",2222,"Nyor Nyar","vegetarian penang white curry","Pack","Malaysia","5","vegetarian"
"920",2164,"Tseng Noodles","rice noodle chinese mushroom with soybean vegetarian braised pork flavor","Pack","Taiwan","5","vegetarian"
"921",2069,"Doll","instant noodle vegetarian flavour","Pack","Hong Kong","3.75","vegetarian"
"922",2065,"Four Seas","kung tak lam vegetarian noodle (mushroom)","Pack","Hong Kong","3","vegetarian"
"923",2063,"Mamee","pepper noodles vegetarian","Pack","Hong Kong","3.25","vegetarian"
"924",2038,"A1","vegetarian herbal noodle","Pack","Malaysia","1.5","vegetarian"
"925",2012,"MAMA","vegetarian instant noodles shiitake flavour","Pack","Thailand","2","vegetarian"
"926",1957,"MAMA","cup vegetarian instant noodles tom yum flavour","Cup","Thailand","4","vegetarian"
"927",1817,"Hao Way","penang vegetarian prawn instant bowl noodles","Bowl","Malaysia","4","vegetarian"
"928",1808,"Mama","vegetarian instant cup noodle tofu & shiitake flavour","Cup","Thailand","3.5","vegetarian"
"929",1803,"Mama","vegetarian instant noodles tom yum flavour","Pack","Thailand","4","vegetarian"
"930",1729,"Vedan","zan vegetarian instant noodle series shiitake mushroom flavour","Cup","Taiwan","2.75","vegetarian"
"931",1711,"Hao Way","vegetarian penang laksa","Pack","Malaysia","4","vegetarian"
"932",1679,"Ten-In","veggie world vegetarian braised beef instant noodles","Bowl","Taiwan","3.5","vegetarian"
"933",1673,"Lishan Food Manufacturing","black cock brand vegetarian chicken noodle","Pack","Taiwan","3.5","vegetarian"
"934",1669,"A-One","mi ly instant noodles mi chay vegetarian flavor","Cup","Vietnam","1.25","vegetarian"
"935",1644,"Hao Way","vegetarian penang laksa instant bowl noodles","Bowl","Malaysia","2","vegetarian"
"936",1608,"Hao Way","penang vegetarian prawn instant noodles","Pack","Malaysia","4.5","vegetarian"
"937",1574,"Chering Chang","steam vegetarian flavor noodles","Pack","Taiwan","3.5","vegetarian"
"938",1353,"Mamee","instant noodles vegetarian flavour","Pack","Malaysia","3.75","vegetarian"
"939",1114,"Maitri","vegetarian fried noodles (mie goreng)","Pack","Indonesia","4","vegetarian"
"940",957,"Sakurai Foods","100% vegetarian soy sauce flavor","Pack","Japan","4.25","vegetarian"
"941",926,"Ibumie","vegemee vegetarian flavour","Pack","Malaysia","2.75","vegetarian"
"942",861,"Vina Acecook","hao hao mi chay vegetarian","Pack","Vietnam","3.25","vegetarian"
"943",856,"Little Cook","mushroom vegetarian","Bowl","Thailand","4.75","vegetarian"
"944",836,"Binh Tay","mi chay vegetarian","Pack","Vietnam","3.5","vegetarian"
"945",833,"Wai Wai","vegetarian","Pack","Thailand","3.5","vegetarian"
"946",808,"Kim's Bowl","vegetarian tom yum","Bowl","Thailand","3.5","vegetarian"
"947",767,"Fashion Foods","mushroom vegetarian","Bowl","Thailand","1.75","vegetarian"
"948",691,"Mamee","express cup vegetarian","Cup","Malaysia","2","vegetarian"
"949",668,"Saigon Ve Wong","kung fu vegetarian","Bowl","Vietnam","2","vegetarian"
"950",623,"Wei Wei","""a"" series vegetarian","Pack","Taiwan","3.25","vegetarian"
"951",598,"Little Cook","vegetarian","Cup","Thailand","3.25","vegetarian"
"952",520,"Nan Hsing","vegetarian rice noodles","Bowl","Taiwan","0.25","vegetarian"
"953",389,"Mama","vegetarian tom yum","Pack","Thailand","2.75","vegetarian"
"954",347,"Sunny Maid","mi chay vegetarian","Pack","Taiwan","1.75","vegetarian"
"955",341,"Vina Acecook","daily vegetarian","Pack","Vietnam","3.75","vegetarian"
"956",307,"Royal Umbrella","vegetarian tom yum","Cup","Thailand","2.75","vegetarian"
"957",145,"Sakurai","vegetarian flavor","Pack","Japan","3.5","vegetarian"
"958",127,"Vifon","mi chay vegetarian","Pack","Vietnam","2.8","vegetarian"
"959",103,"Ve Wong","vegetarian flavor","Pack","Taiwan","3","vegetarian"
"960",43,"Kim Ve Wong","jaopai series: vegetarian instant noodles","Bowl","Taiwan","0","vegetarian"
