"","Review..","Brand","Variety","Style","Country","Stars","Flavour"
"581",1515,"Nongshim","neoguri udon seafood & mild","Pack","South Korea","4","seafood"
"582",1514,"Maggi","royale penang seafood curry","Pack","Malaysia","4.5","seafood"
"583",1468,"Mama","instant cup noodles seafood pad kee mao flavour","Cup","Thailand","5","seafood"
"584",1455,"Nissin","premium instant noodles xo sauce seafood flavour","Pack","Singapore","3.75","seafood"
"585",1451,"Nissin","cup noodles tom yam seafood flavour","Cup","Singapore","4","seafood"
"586",1449,"Nissin","cup noodles seafood curry flavour","Cup","Singapore","4","seafood"
"587",1423,"Vina Acecook","king chef seafood with kimchi flavour","Pack","Vietnam","3","seafood"
"588",1404,"Thai Choice","instant noodles seafood flavour","Cup","Thailand","4","seafood"
"589",1397,"Wu-Mu","steam seafood flavor ramen","Pack","Taiwan","4","seafood"
"590",1320,"Mama","instant noodles cup seafood flavour","Cup","Thailand","3.75","seafood"
"591",1309,"Yum Yum","oriental style instant noodles seafood flavour","Cup","Thailand","3.75","seafood"
"592",1288,"Sau Tao","qq scallop seafood vermicelli","Bowl","Hong Kong","3.75","seafood"
"593",1285,"Lucky Me!","supreme chow mein seafood flavor instant stir-fried noodles","Bowl","Philippines","3.25","seafood"
"594",1224,"HoMyeonDang","premium noodle house seafood ramyun","Pack","South Korea","4","seafood"
"595",1158,"Nissin","demae iccho xo sauce seafood flavour","Bowl","Hong Kong","4","seafood"
"596",1070,"HoMyeonDang","premium noodle house pork & seafood flavor","Pack","South Korea","4","seafood"
"597",916,"Goku Uma","seafood flavor japanese noodles","Bowl","Japan","4.25","seafood"
"598",907,"Nongshim","neoguri spicy seafood","Cup","South Korea","4","seafood"
"599",903,"Han's South Korea","rice noodle with seafood flavored soup","Tray","South Korea","3.5","seafood"
"600",880,"Golden Wheat","south korean style seafood","Cup","China","2.75","seafood"
"601",857,"Sempio","seafood vermicelli anchovy","Bowl","South Korea","4.25","seafood"
"602",775,"JML","seafood","Bowl","China","3","seafood"
"603",764,"Sempio","seafood noodle cup","Bowl","South Korea","3.5","seafood"
"604",735,"Ottogi","odongtong myon seafood","Bowl","South Korea","2.75","seafood"
"605",722,"Yamamoto","seafood ramen","Bowl","Japan","3.5","seafood"
"606",687,"Nissin","cup noodles xo sauce seafood","Cup","Hong Kong","3.75","seafood"
"607",684,"Dragonfly","artificial seafood","Pack","China","3.75","seafood"
"608",648,"Nongshim","seafood ramyun","Pack","South Korea","3.75","seafood"
"609",633,"Mr. Udon","seafood selection","Pack","South Korea","3.5","seafood"
"610",602,"Nongshim","oolongmen artificial seafood","Cup","South Korea","3.5","seafood"
"611",594,"Haioreum","asian style noodles seafood","Bowl","South Korea","3.5","seafood"
"612",538,"Lucky Me!","lomi seafood vegetable","Pack","Philippines","0.5","seafood"
"613",524,"Nissin","cup noodles spicy seafood","Cup","Hong Kong","3.75","seafood"
"614",516,"Wang","champong spicy seafood","Bowl","South Korea","3.5","seafood"
"615",507,"Dragonfly","artificial seafood","Bowl","China","3.75","seafood"
"616",497,"Nissin","demae iccho seafood & abalone macaroni","Pack","Japan","4","seafood"
"617",494,"Snapdragon","tomato seafood rice noodle","Cup","Singapore","3.5","seafood"
"618",441,"Ottogi","spice seafood","Pack","South Korea","3.75","seafood"
"619",439,"Little Cook","tom yum seafood creamy","Bowl","Thailand","3","seafood"
"620",432,"Ve Wong","instant bean thread seafood","Bowl","Taiwan","2.5","seafood"
"621",400,"Nissin","cup noodles seafood curry","Cup","Hong Kong","4.25","seafood"
"622",399,"Paldo","spicy seafood","Cup","South Korea","3.75","seafood"
"623",294,"Paldo","south korean seafood","Pack","South Korea","3.75","seafood"
"624",284,"Nissin","cup noodles seafood","Cup","Hong Kong","4.5","seafood"
"625",279,"Rhee Bros Assi","rice noodles seafood","Tray","South Korea","3.75","seafood"
"626",259,"Vina Acecook","mi lau thai seafood","Pack","Vietnam","4","seafood"
"627",255,"Mama","oriental kitchen spicy seafood","Cup","Thailand","3.75","seafood"
"628",237,"Koka","spicy seafood marinara","Bowl","Singapore","3","seafood"
"629",208,"Sao Tao","ramen king scallop seafood","Pack","China","4.25","seafood"
"630",171,"Samyang","japanese seafood flavor udon","Pack","South Korea","3.75","seafood"
"631",169,"Samyang","seafood party","Pack","South Korea","2.25","seafood"
"632",150,"Chorip Dong","jjambbong hot spicy seafood","Bowl","South Korea","4.25","seafood"
"633",141,"Six Fortune","seafood flavor","Pack","South Korea","2.5","seafood"
"634",111,"Ottogi","odongtongmyon seafood spicy","Pack","South Korea","3.25","seafood"
"635",92,"Fashion Food","tom yum seafood creamy","Bowl","Thailand","2","seafood"
"636",78,"Nissin","demae ramen seafood","Pack","Japan","2.5","seafood"
"637",70,"Nissin","demae ramen xo sauce seafood","Pack","Japan","4","seafood"
"638",54,"Hua Feng Noodle Expert","spicy seafood flavor","Pack","China","3","seafood"
"639",24,"Nissin","demae ramen spicy seafood with chili pepper","Pack","Japan","2","seafood"
"640",20,"Nongshim","neoguri (seafood'n'spicy)","Pack","South Korea","3.5","seafood"
"641",2567,"Nissin","deka buto kimchi pork flavor","Bowl","Japan","4.5","pork"
"642",2480,"Acecook","pork wantan men","Bowl","Japan","4.25","pork"
"643",2440,"Master Kong","roasted pork noodle","Pack","China","4.5","pork"
"644",2436,"Kang Shi Fu","artificial dongpo's braised pork flavour","Pack","Hong Kong","4.75","pork"
"645",2390,"Nissin","rice vermicelli pickled vegetable pork flavour","Cup","Hong Kong","3.75","pork"
"646",2375,"Uni-President","man han feast braised pork flavor instant noodles","Bowl","Taiwan","5","pork"
"647",2352,"Uni-President","minced pork flavor instant noodles","Pack","Taiwan","1","pork"
"648",2283,"Nissin","raoh pork bone soy soup noodle","Pack","Japan","5","pork"
"649",2218,"Tseng Noodles","spicy braised pork flavor","Pack","Taiwan","4","pork"
"650",2213,"Acecook","oh! ricey pork flavour","Pack","Vietnam","4","pork"
"651",2211,"Nissin","disney cuties instant noodle roast pork flavour","Cup","Thailand","3","pork"
"652",2168,"Tseng Noodles","rice noodle shallot with braised pork flavor","Pack","Taiwan","5","pork"
"653",2164,"Tseng Noodles","rice noodle chinese mushroom with soybean vegetarian braised pork flavor","Pack","Taiwan","5","pork"
"654",2119,"Nissin","cup noodles minced pork flavour","Cup","Thailand","3.50","pork"
"655",2114,"Nissin","instant noodles minced pork flavour","Pack","Thailand","3.50","pork"
"656",2082,"Nissin","cup noodles pork chowder flavour","Cup","Hong Kong","4","pork"
"657",2051,"Master Kong","artificial pork ribs flavour instant noodle","Pack","China","3.50","pork"
"658",1982,"Master Kong","assorted pork bone noodle","Pack","China","4","pork"
"659",1929,"MAMA","instant noodles minced pork flavour","Pack","Cambodia","3.50","pork"
"660",1871,"Nissin","cup noodles minced pork flavour","Cup","Thailand","3.75","pork"
"661",1867,"Yum Yum","premier bowl instant noodles stewed pork flavour","Bowl","Thailand","4","pork"
"662",1774,"JML","spicy king spicy pork","Pack","China","5","pork"
"663",1773,"JML","supreme bowl noodles with stewed egg sour beans with pork flavour","Bowl","China","4","pork"
"664",1770,"JML","spicy king bowl noodle spicy pork","Bowl","China","4.5","pork"
"665",1730,"Wu-Mu","bbq pork flavor chow mein","Pack","Taiwan","4.5","pork"
"666",1719,"Wai Wai","grilled pork flavour instant noodles","Bowl","Thailand","2.5","pork"
"667",1715,"Yum Yum","instant noodles minced pork flavor","Pack","Thailand","3.75","pork"
"668",1624,"Baixiang Noodles","artificial pork flavour","Pack","China","3","pork"
"669",1600,"Chering Chang","instant non-fried noodles shallot pork flavour","Pack","Taiwan","5","pork"
"670",1577,"Mama","pork flavour whole wheat noodle","Pack","Thailand","3.75","pork"
"671",1564,"A-One","m„¨ ly instant noodles m„¨ th·ªãt x„†o pork flavor","Cup","Vietnam","3","pork"
"672",1547,"Vedan","volcano spicy pork noodle","Bowl","Taiwan","4.25","pork"
"673",1541,"Wu-Mu","steam pork flavour","Pack","Taiwan","3.75","pork"
"674",1535,"Sau Tao","oat noodle pork rib flavored","Pack","Hong Kong","3.5","pork"
"675",1513,"Mama","instant noodles tom yum pork flavour","Pack","Thailand","4","pork"
"676",1502,"JML","artificial pork flavor noodles","Pack","China","4","pork"
"677",1496,"Master Kong","mianba pork ribs flavor instant noodles","Pack","China","4.5","pork"
"678",1419,"Vifon","ngon-ngon tom yum minced pork noodle","Cup","Vietnam","3.5","pork"
"679",1412,"Chewy","non-fried ramen noodles taiwan roast pork flavour","Pack","Hong Kong","4","pork"
"680",1364,"Golden Wheat","korean style stew pork flavour noodle soup","Bowl","China","1.75","pork"
"681",1304,"Nissin","demae ramen shoyu tonkotsu artificial pork flavour","Pack","Hong Kong","4.75","pork"
"682",1281,"Tokachimen Koubou","jet black sesame oil pork tonkotsu","Bowl","Japan","2.25","pork"
"683",1275,"Wu-Mu","ramen with stewed pork flavor","Pack","Taiwan","4.5","pork"
"684",1247,"Maruchan","i want to eat ramen pork tonkotsu flavor","Pack","Japan","4","pork"
"685",1237,"Mama","instant noodles creamy tom yum minced pork flavour","Pack","Thailand","3.5","pork"
"686",1235,"Nissin","demae ramen miso tonkotsu artificial pork flavor ramen noodle","Pack","Hong Kong","3.75","pork"
"687",1220,"Nissin","ultraman instant noodle pork flavour","Cup","Japan","3","pork"
"688",1205,"Mama","instant noodles pork flavour with black pepper","Pack","Thailand","3.5","pork"
"689",1192,"Wu-Mu","ramen with simmered pork flavor","Pack","Taiwan","3.75","pork"
"690",1188,"Chencun","braised pork ribs","Cup","China","3","pork"
"691",1122,"Nagao Noodle","ramen kamen thasos galle pork bone","Pack","Japan","4.25","pork"
"692",1106,"Nissin","raoh rich soy sauce with roast pork (2 slices)","Bowl","Japan","4.5","pork"
"693",1070,"HoMyeonDang","premium noodle house pork & seafood flavor","Pack","South Korea","4","pork"
"694",1050,"Knorr","japanese pork bone flavour quick serve macaroni","Pack","Hong Kong","3","pork"
"695",1042,"Nongshim","potato pork ramyun","Pack","China","5","pork"
"696",1013,"Vina Acecook","oh! ricey h·ªß ti·∫øu sÊ∞·ªùn heo (pork spareribs flavour)","Pack","Vietnam","3.5","pork"
"697",1004,"Wai Wai","artificial pork flavour","Pack","Thailand","3","pork"
"698",929,"Vina Acecook","good artificial minced pork bean vermicelli","Pack","Vietnam","3.75","pork"
"699",928,"Kamfen","dried mix noodles artificial spicy pork","Tray","China","4","pork"
"700",851,"Dragonfly","artificial pork ribs","Bowl","China","3.5","pork"
"701",848,"Golden Wheat","south korean style spicy pork","Cup","China","3.5","pork"
"702",798,"Golden Wheat","south korean style pork","Cup","China","3","pork"
"703",773,"Little Cook","tvp stewed pork","Bowl","Thailand","3.5","pork"
"704",758,"JML","artificial stew pork","Bowl","China","3.25","pork"
"705",708,"Wu Mu","pork flavor ramen","Pack","Taiwan","2.75","pork"
"706",653,"Dragonfly","artificial pork ribs","Pack","China","4","pork"
"707",636,"Yamamori","tom yam ramen pork","Pack","Japan","4.75","pork"
"708",630,"Ve Wong","kung fu artificial mushroom pork","Bowl","Taiwan","1.25","pork"
"709",624,"Master Kong","artificial pork","Pack","China","3.75","pork"
"710",620,"Vifon","phu gia bamboo shoot artificial pork bean thread","Pack","Vietnam","1.25","pork"
"711",613,"Saigon Ve Wong","kung fu artificial pork flavor","Bowl","Vietnam","3","pork"
"712",588,"Vifon","tu quy pork","Pack","Vietnam","2.75","pork"
"713",569,"Saigon Ve Wong","kung fu suc song artificial pork","Bowl","Vietnam","3","pork"
"714",489,"JML","stew pork","Pack","China","3.25","pork"
"715",456,"Ve Wong","kung fu artificial szechuan pork","Bowl","Taiwan","3.75","pork"
"716",368,"Knorr","chili pork","Cup","Thailand","3.5","pork"
"717",358,"Doll","spicy artificial pork","Pack","Hong Kong","3.75","pork"
"718",325,"Mee Jang","artificial pork","Bowl","Thailand","3.5","pork"
"719",316,"Unif","super bowl artificial stewed pork chop","Bowl","Taiwan","3.5","pork"
"720",273,"Wai Wai","minced pork tom yum","Pack","Thailand","2.5","pork"
"721",270,"Wu Mu","dried noodle with bbq pork","Pack","Taiwan","2","pork"
"722",267,"Mama","pork","Cup","Thailand","2","pork"
"723",246,"Mama","artificial pork jumbo","Pack","Thailand","3","pork"
"724",224,"Mama","instant bowl noodles artificial pork","Bowl","Thailand","2.75","pork"
"725",211,"Vina Acecook","kingcook tomato sauce pork","Tray","Vietnam","3.5","pork"
"726",176,"Paldo","dosirac pork","Tray","South Korea","4.125","pork"
"727",158,"Mama","jok cup porridge artificial pork","Cup","Thailand","2.5","pork"
"728",123,"Wai Wai","minced pork soeng kreung","Pack","Thailand","3.7","pork"
"729",119,"Ve Wong","artificial pork & chicken","Pack","Taiwan","3.4","pork"
"730",96,"Saigon Ve Wong","kung fu artificial pork flavor","Pack","Vietnam","3.75","pork"
"731",89,"Unif","100 artificial stewed pork chop","Pack","Taiwan","3.2","pork"
"732",72,"Nissin","demae ramen tonkatsu artificial pork","Pack","Japan","3.5","pork"
"733",55,"Hua Feng Noodle Expert","favoury pork flavor","Pack","China","1","pork"
"734",41,"Little Cook","pork mustard stem","Bowl","Thailand","0.5","pork"
"735",7,"Ve Wong","mushroom pork","Pack","Vietnam","1","pork"
"736",2356,"Nongshim","spicy shrimp cup noodle","Cup","South Korea","4","shrimp"
"737",2317,"MAMA","instant bowl noodles shrimp (tom yum) flavor base","Bowl","Thailand","4","shrimp"
"738",2235,"Fashion Food","tom yum shrimp creamy flavour instant noodles","Bowl","Thailand","4","shrimp"
"739",2123,"Nissin","cup noodles tom yum shrimp sabb flavour","Cup","Thailand","5","shrimp"
"740",2120,"Nissin","super tom yum shrimp","Cup","Thailand","3.50","shrimp"
"741",2118,"Nissin","chilli noodles tom yum shrimp creamy soup flavour","Cup","Thailand","3.25","shrimp"
"742",2117,"7 Select","nissin instant noodles shrimp ma nao lui suan flavour king cup","Bowl","Thailand","4","shrimp"
"743",2116,"Nissin","instant noodles tom yum shrimp saab flavour","Pack","Thailand","4.0","shrimp"
"744",2058,"Zow Zow","instant noodle shrimp tom yam flavoured","Pack","Thailand","3.75","shrimp"
"745",2033,"Chaudhary's Wai Wai","instant noodles artificial chicken & shrimp flavored","Pack","India","2.5","shrimp"
"746",1994,"Nissin","gyoretsu-no-dekiru-mise-no-ramen (shrimp tantanmen)","Bowl","Japan","5","shrimp"
"747",1949,"Bamee","oriental style instant noodles shrimp flavour (tom yum)","Pack","Thailand","3.5","shrimp"
"748",1939,"MAMA","instant noodles shrimp creamy tom yum flavour","Pack","Myanmar","5","shrimp"
"749",1865,"Mama","shrimp tom yum flavour cup noodles","Cup","Myanmar","3.5","shrimp"
"750",1845,"Mama","oriental style instant noodles shrimp flavour","Pack","Bangladesh","3.25","shrimp"
"751",1767,"Mama","instant noodles shrimp tom yum flavour","Pack","Cambodia","4","shrimp"
"752",1743,"Mama","rangers snack noodles shrimp tom yum flavour","Pack","Myanmar","4.5","shrimp"
"753",1738,"Little Cook","instant noodles shrimp tom yum flavour","Cup","Thailand","4.25","shrimp"
"754",1731,"Mama","instant noodles creamy shrimp tom yum flavour","Pack","Cambodia","5","shrimp"
"755",1703,"7 Select/Nissin","super tom yum shrimp","Cup","Thailand","3.5","shrimp"
"756",1695,"Mama","cup shrimp creamy tom yum","Cup","Thailand","5","shrimp"
"757",1625,"Mama","instant rice noodle soup spicy shrimp flavour","Bowl","Thailand","5","shrimp"
"758",1598,"Mama","cup rice vermicelli shrimp creamy tom yum","Cup","Thailand","4","shrimp"
"759",1581,"United","3 con tom instant noodles thailand sour shrimp flavor","Pack","Vietnam","2.75","shrimp"
"760",1536,"Paldo Vina","koreno premium shrimp flavor","Pack","Vietnam","3.25","shrimp"
"761",1492,"Wai Wai","quick zabb tom yum shrimp flavour instant noodles","Pack","Thailand","4","shrimp"
"762",1486,"Mom's Dry Noodle","onion oil & shrimp flavor","Pack","Taiwan","5","shrimp"
"763",1474,"Mama","instant noodle shrimp tom yum flavour jumbo pack","Pack","Thailand","4","shrimp"
"764",1473,"Mama","instant cup noodles shrimp tom yum flavour (extreme)","Cup","Thailand","5","shrimp"
"765",1471,"Mama","instant noodles shrimp creamy tom yum flavour jumbo pack","Pack","Thailand","5","shrimp"
"766",1325,"Koka","spicy shrimp tom yam flavour","Cup","Singapore","3.25","shrimp"
"767",1301,"Knorr","quick serve macaroni shrimp broth","Pack","Hong Kong","3.25","shrimp"
"768",1291,"A-One","m„¨ ly instant noodles m„¨ t„¥m shrimp flavor","Cup","Vietnam","3.25","shrimp"
"769",1255,"Thai Choice","instant noodles shrimp flavour","Cup","Thailand","3.25","shrimp"
"770",1154,"Golden Wheat","korean style shrimp flavour cooking noodle","Pack","China","3.5","shrimp"
"771",1085,"Vina Acecook","hao hao mi goreng shrimp & onion flavour","Pack","Vietnam","3.5","shrimp"
"772",1036,"Golden Wheat","korean style spicy shrimp noodle soup","Bowl","China","3.5","shrimp"
"773",994,"Wai Wai","tom yum shrimp flavour","Pack","Thailand","3.25","shrimp"
"774",937,"Mama","shrimp (tom yum)","Pack","Thailand","3.75","shrimp"
"775",913,"Nongshim","spicy shrimp cup ramyun","Cup","South Korea","4.25","shrimp"
"776",893,"Paldo","bowl noodle shrimp flavor","Bowl","South Korea","3.25","shrimp"
"777",871,"Dragonfly","artificial hot & sour shrimp","Pack","China","4","shrimp"
"778",855,"Vina Acecook","bestcook hot & sour shrimp","Bowl","Vietnam","4.25","shrimp"
"779",820,"Sunlee","tom yum shrimp rice stick","Bowl","Thailand","3.75","shrimp"
"780",817,"Souper","bowl ramen shrimp","Bowl","Taiwan","3.75","shrimp"
"781",801,"Gau Do","hot sour shrimp","Pack","Vietnam","3.75","shrimp"
"782",737,"Gau Do","chicken shrimp","Pack","Vietnam","2.5","shrimp"
"783",689,"Mee Jang","noodle soup sour spicy shrimp tom yum","Bowl","Thailand","2.5","shrimp"
"784",680,"Vina Acecook","kingcook shrimp","Pack","Vietnam","2.75","shrimp"
"785",677,"Nongshim","shin ramyun shrimp","Pack","China","4.5","shrimp"
"786",676,"Indomie","spicy coconut shrimp","Pack","Indonesia","4.75","shrimp"
"787",647,"Sunlee","tom yum shrimp noodle","Bowl","Thailand","3.5","shrimp"
"788",641,"Vina Acecook","hao hao shrimp onion","Pack","Vietnam","3","shrimp"
"789",559,"Wai Wai","quick tom yum shrimp","Cup","Thailand","3","shrimp"
"790",554,"Yum Yum","shrimp tom yum flavor","Pack","Thailand","3.5","shrimp"
"791",530,"Mee Jang","artificial shrimp tom yum","Bowl","Thailand","3.5","shrimp"
"792",523,"Dragonfly","artificial hot & sour shrimp","Bowl","China","4.5","shrimp"
"793",509,"Ve Wong","kung fu shrimp","Bowl","Taiwan","4","shrimp"
"794",474,"Saigon Ve Wong","kung fu rice noodle shrimp crab ","Bowl","Vietnam","3.75","shrimp"
"795",467,"Vifon","tu quy sour spicy shrimp","Pack","Vietnam","1.75","shrimp"
"796",408,"Gomex","3 mien mi tom chua cay hot sour shrimp","Pack","Vietnam","2.25","shrimp"
"797",396,"Vina Acecook","bestcook hot spicy tom yum shrimp","Bowl","Vietnam","4.25","shrimp"
"798",374,"Vifon","asian style instant noodles shrimp","Pack","Vietnam","3.75","shrimp"
"799",362,"Vina Acecook","daily hot & sour with shrimp","Pack","Vietnam","4.5","shrimp"
"800",324,"Nongshim","big bowl spicy shrimp","Bowl","South Korea","3.5","shrimp"
"801",322,"Unif","shrimp fish","Bowl","Taiwan","3.75","shrimp"
"802",313,"Paldo","dosirac shrimp","Tray","South Korea","4.25","shrimp"
"803",275,"Mama","cup shrimp tom yum flavor","Cup","Thailand","3.75","shrimp"
"804",269,"Paldo","spicy shrimp bowl","Bowl","South Korea","3.5","shrimp"
"805",266,"Vina Acecook","mi lau thai shrimp","Pack","Vietnam","4","shrimp"
"806",264,"Vina Acecook","hao hao sour hot shrimp","Pack","Vietnam","3.75","shrimp"
"807",258,"Royal Umbrella","tom yum shrimp","Cup","Thailand","3.25","shrimp"
"808",234,"Myojo","udon shrimp","Pack","Japan","3.75","shrimp"
"809",193,"Boss","shrimp tom yum flavor","Bowl","Thailand","2.5","shrimp"
"810",173,"Unif / Tung-I","instant bean vermicelli shrimp","Pack","Taiwan","1.5","shrimp"
"811",138,"Unif","100 furong shrimp","","Taiwan","3","shrimp"
"812",136,"Mama","shrimp creamy tom yum","Pack","Thailand","5","shrimp"
"813",135,"Unif / Tung-I","fresh shrimp","Pack","Taiwan","3.25","shrimp"
"814",122,"Doll","shrimp wonton","Pack","Hong Kong","4","shrimp"
"815",97,"Saigon Ve Wong","kung fu mi tom chua sour shrimp","Pack","Vietnam","2.5","shrimp"
"816",87,"Wai Wai","tom yum shrimp cream soup","Pack","Thailand","2.75","shrimp"
"817",58,"Ve Wong","a-one bun tom shrimp","Pack","Taiwan","3","shrimp"
"818",48,"Indomie","shrimp flavor","Pack","Indonesia","3","shrimp"
"819",29,"Mee Jang","tom yum shrimp","Bowl","Thailand","3.5","shrimp"
"820",12,"Sapporo Ichiban","shrimp flavor","Pack","Japan","2.5","shrimp"
"821",3,"Wai Wai","tom yum shrimp","Pack","Thailand","2","shrimp"
"822",2579,"Just Way","noodles spicy hot sesame spicy hot sesame guan-miao noodles","Pack","Taiwan","1","sesame"
"823",2462,"TTL","sesame oil chicken noodle with rice wine","Bowl","Taiwan","5","sesame"
"824",2453,"KOKA","delight spicy sesame flavor instant non-fried noodles","Pack","Singapore","4.5","sesame"
"825",2428,"TTL","sesame oil chicken with rice wine noodle","Bowl","Taiwan","5","sesame"
"826",2387,"Nissin","demae iccho sesame oil flavour instant noodle","Bowl","Hong Kong","3.5","sesame"
"827",2313,"Xiao Ban Mian","sesame oil with garlic flavor thin noodle","Pack","Taiwan","3.50","sesame"
"828",2311,"Xiao Ban Mian","sesame sauce matcha noodle","Pack","Taiwan","3.8","sesame"
"829",2189,"Nissin","demae ramen sesame oil flavour cup","Cup","Hong Kong","4","sesame"
"830",2154,"Jingqi","black eyes bean original noodle with sesame sauce","Pack","Taiwan","4","sesame"
"831",2151,"Jingqi","aloe vera guan mian original noodle with sesame sauce","Pack","Taiwan","5","sesame"
"832",2086,"Nissin","demae ramen sesame flavour instant noodles","Pack","Hong Kong","5","sesame"
"833",2083,"Nissin","taisho fried noodle sesame paste flavour instant noodle","Pack","Hong Kong","5","sesame"
"834",1915,"Itsuki","yuzu sesame sauce udon","Bowl","Japan","4.5","sesame"
"835",1843,"Forest Noodles","sunbaked noodles with sesame sauce","Pack","Taiwan","4.5","sesame"
"836",1840,"Forest Noodles","sweet potato noodles with sesame paste sauce","Pack","Taiwan","3.25","sesame"
"837",1829,"Tseng Noodles","hu sesame flavor","Pack","Taiwan","5","sesame"
"838",1762,"Mom's Dry Noodle","sesame & pepper","Pack","Taiwan","4","sesame"
"839",1725,"A-Sha Dry Noodle","veggie noodle black sesame noodle","Pack","Taiwan","3.25","sesame"
"840",1650,"Ottogi","sesame flavor ramen korean style instant noodle","Pack","South Korea","4.25","sesame"
"841",1592,"Mom's Dry Noodle","vegan chilli with sesame sauce","Pack","Taiwan","5","sesame"
"842",1524,"Nissin","chu qian yi ding spicy sesame flavour instant noodles with soup base","Pack","Singapore","3.5","sesame"
"843",1511,"Long Jun Hang","tainan yi mien with sesame oil sauce","Pack","Taiwan","3.25","sesame"
"844",1457,"Nissin","chu qian yi ding sesame oil flavour","Pack","Singapore","3.75","sesame"
"845",1281,"Tokachimen Koubou","jet black sesame oil pork tonkotsu","Bowl","Japan","2.25","sesame"
"846",1254,"Four Seas","sesame oil chicken flavour instant noodle","Bowl","Hong Kong","2.75","sesame"
"847",1238,"Sapporo Ichiban","sesame ramen","Pack","Japan","5","sesame"
"848",1121,"Sau Tao","oat noodle sesame oil flavored","Pack","China","3.75","sesame"
"849",1097,"Amianda","homely dried noodles - sesame pate","Pack","Taiwan","3.75","sesame"
"850",1094,"Amianda","thin noodles - sesame oil","Pack","Taiwan","4.25","sesame"
"851",1081,"Deshome","aloe noodle sesame sauce","Pack","Taiwan","3.25","sesame"
"852",1080,"Deshome","black eyed beans noodle basil sauce & sesame sauce","Pack","Taiwan","3.5","sesame"
"853",1078,"Deshome","black eyed beans noodle spicy soybean sauce & sesame sauce","Pack","Taiwan","3.75","sesame"
"854",1077,"Deshome","aloe noodle red onion & sesame sauce","Pack","Taiwan","5","sesame"
"855",1076,"Deshome","black eyed beans noodle vegetable sauce & sesame sauce","Pack","Taiwan","3.75","sesame"
"856",1074,"Deshome","pollen noodles sesame sauce & soy sauce","Pack","Taiwan","4.25","sesame"
"857",1073,"Deshome","black eyed bean noodle red onion sauce & sesame sauce","Pack","Taiwan","3.75","sesame"
"858",1057,"A-Sha Dry Noodle","dry noodle hakka noodle - spicy sesame oil sauce","Pack","Taiwan","3.5","sesame"
"859",1053,"A-Sha Dry Noodle","dry noodle tainan noodle - sesame sauce","Pack","Taiwan","4","sesame"
"860",1008,"Ottogi","sesame flavor noodle bowl","Bowl","South Korea","3.5","sesame"
"861",1007,"Nissin","demae ramen sesame oil flavour noodles with soup base","Bowl","Hong Kong","4.5","sesame"
"862",956,"Sakurai Foods","sesame noodles","Pack","Japan","5","sesame"
"863",617,"Nissin","demae iccho sesame oil chicken macaroni","Pack","Japan","3.75","sesame"
"864",448,"Ve Wong","kung fu artificial sesame chicken","Bowl","Taiwan","3.75","sesame"
"865",424,"Q","noodle with sesame sauce","Pack","Taiwan","3.25","sesame"
"866",250,"Wu Mu","steamed noodle sesame oil","Pack","Taiwan","3.75","sesame"
"867",236,"Koka","spicy sesame","Pack","Singapore","5","sesame"
"868",195,"Myojo","chukazanmai served cool sesame flavored rice vinegar sesame","Pack","Japan","3","sesame"
"869",165,"Doll","sesame oil","Pack","Hong Kong","3.5","sesame"
"870",152,"Wu Mu","steamed noodle garlic & sesame oil","Pack","Taiwan","4.5","sesame"
"871",101,"Ve Wong","artificial sesame chicken","Pack","Taiwan","4.25","sesame"
"872",85,"Nissin","demae ramen sesame","Pack","Japan","3.75","sesame"
"873",56,"Doll","instant noodles with sesame oil & soup base","Pack","Hong Kong","1","sesame"
"874",2566,"Nissin","demae ramen bar noodle aka tonkotsu flavour instant noodle","Pack","Hong Kong","5","tonkotsu"
"875",2553,"Nissin","hakata ramen noodle white tonkotsu","Bowl","Japan","4.75","tonkotsu"
